2020,Dengan cara menerapkan biaya internet gratis dan membuat desain pembelajaran semenarik mungkin
2019,yang ada saat ini mungkin sudah efektif tetapi efektifitas dari pembelajaran jarak jauh tidak bisa semaksimal pembelajaran yang normal pada umumnya
2019,Lebih efektif pembelajaran jarak dekat
2019,"Lebih baik pembelajaran secara dekat atau disebut offline,karena yg jauh ingin selalu dekat atau mendekati nya, cape cuyy kalo pembelajaran online terus pinter kaga mumet iya "
2019,"Yg efektif menurut saya tergantung cara dosen atau cara guru untuk mengajak para audience atau murid/mahasiswa dengan merangkul atau dengan komunikasi yang baik, yg efektif lagi yaitu menggunakan cara yang unik dalam melakukan pembelajaran, sehingga pada murid/mahasiswa tidak boring dalam pembelajaran jarak jauh, karena ada sesuatu yg menarik perhatian mereka"
2019,"Menurut saya pembelajaran yg efektif itu, ketika dosen dan mahasiswa bisa saling mengerti dan bekerja sama, pembelajaran daring dengan via zoom atau yg lainnya dengan diikuti mahasiswa juga yg serius dalam pembelajaran, berfikir bagaimana menentukan rencana kedua jika rencana pertama ada kendala"
2019,"pembelajaran yg di dengan berkelompok,karna apabila berkelompok kita mendapatkan materi tidak dari dosen saja,kita bisa sharing dan memecahkan masalah dengan bersama,dan tidak suntuk untuk mendengarkan dosen berbicara."
2019,Mungkin tgs bisa di seimbangin lagi 
2019,perbanyakin materi belajar praktek yang dikirim lewat video
2019,Lebih tepat waktu memulai dan mengakhiri pembelajaran 
2019,Gaada efektifnya 
2019,"Saya gak tau ini sebuau efektifitas atau tidak. Namun dari opini saya, untuk pembelajaran jauh perlu ada nya kepekaan diri antara pelajar dan pengajar disaat pembelajaran. Sebab, banyak (entah pengajar / pelajar) yang melakukan hal yang tidak semestinya dilakukan disaat / sebelum pembelajaran. Dan juga perlu memberikan rasa nyaman dari pengajar untuk pelajar agar pelajar merasakan nyaman juga diajar oleh pengajar dan senang diajarkan oleh pengajar tersebut.  "
2019,"Kelola waktu dengan baik, selesai belajar online membuat ringkasan evaluasi belajar, mempastikan jaringan internet stabil selama belajar agar tidak terganggu"
2019,"dimana dosen dan mahasiswa tetap bisa merasa seperti berada disebuah kelas dan di tambah dengan memanfaatkan semua teknologi yang disediakan di komputer sehingga, mahasiswa lebih mudah untuk memahami, karna yang saya lihat sejauh ini banyak dosen yang hanya menggunakan 1 atau 2 aplikasi saja padahal banyak sekali aplikasi"" yang dapat membantu proses blajara mengajar. Dan juga mahasiswa harus benar"" fokus ketika pertemuan karena ketika kalian tidak fokus pada saat KBM itu sangat merugikan kalian sendiri karena tidak dapat mengerti ketika ujian nanti."
2019,"Interaksi mahasiswa dengan dosen secara lancar, mengurangi tugas dan menambahkan penjelasan saat pembelajaran"
2019,Lebih memerhatikan kondisi mahasiswa
2019,Dengan melakukan interak
2019,Menurut saya yaitu tingkatkan rasa Toleransi antara Mahasiswa dan Dosen dalam hal ini adalah kontrak belajar dengan tidak membebaninya dengan banyak Tugas salah satu contohnya
2019,"Seharusnya kita saling tidak miskomunikasi dengan teman ataupun dosen . Sehingga kita bisa menciptakan suasana yang nyaman, dengan cara itu pembelajaran yang berlangsung tidak akan terasa tegang, membosankan, dan lebih asik."
2020,"mungkin yg efektif adalah PJJ yg jadwalnya teratur dan tetap, beberapa guru suka melebih-lebihkan waktu belajar seperti saat sedang zoom/meet padahal waktunya sudah habis"